{
  "schema_version": "educational-design-response/v1",
  "request_id": "request-v0-1-fixture",
  "knowledge_snapshot_id": "track-a-itchio-v1.1-knowledge-v1",
  "evidence_status": "limited",
  "evidence_status_basis": {
    "assessment_source": "generation_model",
    "rationale": "The creator-described precedent is relevant but does not establish learning effectiveness."
  },
  "request_interpretation": "Explore one author-reviewable educational interactive-fiction direction.",
  "design_directions": [
    {
      "direction_id": "direction-1",
      "title": "Consequential ecological choices",
      "concept": "Use visible consequences to support reflection without claiming measured outcomes.",
      "design_dimensions": {
        "educational_purpose": {
          "value": "Ecological reflection",
          "basis": ["user_request"]
        },
        "intended_audience": {
          "value": "To be decided by the author",
          "basis": ["open_question"]
        },
        "application_setting": {
          "value": "Facilitated discussion",
          "basis": ["agent_proposal"]
        },
        "interactive_narrative_form": {
          "value": "Branching interactive fiction",
          "basis": ["knowledge_precedent"]
        },
        "interaction_education_relationship": {
          "value": "Choices make competing consequences inspectable",
          "basis": ["agent_adaptation"]
        }
      },
      "interaction_mechanism": "Players choose among actions and inspect their consequences.",
      "educational_relationship": "The consequences create prompts for reflection and discussion.",
      "knowledge_support": [
        {
          "knowledge_id": "kc-itchio-0006-v1-1",
          "match_kind": "partial",
          "assessment_source": "generation_model",
          "use": "Provides a creator-described precedent for choices in an environmental learning context."
        }
      ],
      "applicability_conditions": ["The design can expose consequences without presenting one interpretation as correct."],
      "transfer_assumptions": ["The precedent can transfer to the proposed topic."],
      "risks": ["The educational relationship may remain too implicit."]
    }
  ],
  "limitations": ["Creator descriptions do not demonstrate learning effectiveness."],
  "follow_up_questions": ["Which audience and setting should anchor the next pass?"]
}
